{
  "baseRev": 1,
  "changes": [
    {
      "id": "edge.hsts",
      "schedule": "6h"
    },
    {
      "id": "email.dkim",
      "enabled": false,
      "note": "DKIM moves to the new mail provider this week."
    },
    {
      "id": "data.db_integrity",
      "severityOverride": "high"
    }
  ],
  "alerts": {
    "dedupeHours": 12
  },
  "actor": {
    "kind": "human",
    "osUserId": "7b2e4c1a-3f5d-4e8a-9c0b-1d2e3f4a5b6c",
    "name": "Jane PM",
    "role": "PM"
  }
}
